"index","label","content","train","idx"
"1151","1151","https www huffingtonpost entry democrat shri thanedar usda report cites violations animal testing lab_us_5afc7150e4b06a3fb50cffeb report contradicts michigan governor candidate test animal treatment politics agriculture department animal welfare violations democrat shri thanedar’s chemical testing facility daniel marans","1","1151"
"1152","1152","https www huffingtonpost entry pauley perrette ncis cbs response_us_5afbf55fe4b06a3fb50c122c pauley perrette responds cbs statement multiple assaults claim entertainment ncis actress said earlier publicity machine keeping silent assaults ron dicker","1","1152"
"1153","1153","https www huffingtonpost entry seth meyers sarah huckabee sanders spoof interview_us_5afbcdb5e4b0779345d40956 sarah huckabee sanders unusually honest seth meyers spoof briefing comedy president lot respect people sole job carry law lee moran","0","1153"
"1154","1154","https www huffingtonpost entry yanny laurel debate explanation real answer_us_5afc7463e4b0779345d54ad9 yanny laurel here’s real answer weird news drumroll elyse wanshel","1","1154"
"1155","1155","https www huffingtonpost entry queer kid stuff activism video_us_5af9ef51e4b0200bcab7ede9 adorable video kids shows activism literally easy pie queer voices it’s want change change curtis wong","-1","1155"
"1156","1156","https www huffingtonpost entry maryland outlaws gay conversion therapy_us_5afb185ce4b0200bcab94bf2 gay conversion therapy illegal maryland queer voices growing number states adopted similar legislation protect lgbtq youth nina golgowski","1","1156"
"1157","1157","https www huffingtonpost entry khlo kardashian explains chose true daughters name_us_5afb0a00e4b044dfffb649dd khloé kardashian explains chose true daughter entertainment khloé kardashian opening decided daughter true keeping kardashians star taryn ryder yahoo entertainment","-1","1157"
"1158","1158","https www huffingtonpost entry adam rippon dancing stars contemporary_us_5afaf913e4b09a94524c5834 adam rippon honors mom stunning dancing stars performance queer voices skater impressed emotional contemporary routine set familiar song curtis wong","1","1158"
"1159","1159","https www huffingtonpost entry keith richards donald trump_us_5afa8518e4b044dfffb56584 keith richards explains got rid trump nearly years ago entertainment america rid don’t didn’t warn mazza","1","1159"
"1160","1160","https www huffingtonpost entry meet openly trans man graduate spelman college_us_5afae6c1e4b09a94524c336e meet openly trans man graduate spelman college black voices people opinions attending spelman it’s spelman jenna amatulli","1","1160"
"1161","1161","https www huffingtonpost entry democrats nra president oliver north_us_5afafb36e4b044dfffb62da9 debbie wasserman schultz nra shy terrorist organization politics gun group worked perpetuate culture violence country congresswoman said nick wing","1","1161"
"1162","1162","https www huffingtonpost entry harry reid pancreatic cancer_us_5af9d850e4b09a94524b11bc senator harry reid diagnosed pancreatic cancer politics reid underwent surgery monday remove tumor according family doha madani","1","1162"
"1163","1163","https www huffingtonpost entry good movies netflix_us_5af98954e4b0e57cd9fbb43f movies coming netflix week entertainment surprise netflix adds pretty good sci movie todd van luling","1","1163"
"1164","1164","https www huffingtonpost entry channing tatum mothers days message jenna dewan_us_5af99bd9e4b00d7e4c1cfa23 channing tatum mother day message jenna dewan love entertainment couplegoals exgoals cole delbyck","1","1164"
"1165","1165","https www huffingtonpost entry ufc raquel pennington amanda nunes_us_5af99e9ee4b032b10bfd142d coach tells hurt ufc fighter continue says sports raquel pennington took beating bloody loss champion amanda nunes ron dicker","1","1165"
"1166","1166","https www huffingtonpost entry donald trump tweet leakers traitors_us_5af9fdfae4b0200bcab80175 donald trump lashes called leaks twitter users pounce politics paraphrased trump food awful portions small david moye","0","1166"
"1167","1167","https www huffingtonpost entry harrison ford alden ehrenreich_us_5af919aee4b00d7e4c1bdc3e harrison ford crashes new han solo actor interview life entertainment meeting hans mazza","1","1167"
"1168","1168","https www huffingtonpost entry chilis hit data breach credit debit card information compromised_us_5af990d1e4b032b10bfcf61a chili hit data breach credit debit card information compromised business breach believed occurred march april jenna amatulli","1","1168"
"1169","1169","https www huffingtonpost entry amy schumer girl raunch snl_us_5af7b700e4b032b10bfb5d10 amy schumer goes girl raunch saturday night live comedy disses husband chris fischer marriage proposal mary papenfuss","1","1169"
"1170","1170","https www huffingtonpost entry century security guard shoplifter arrested_us_5af78d65e4b00d7e4c1b39cc video shows security guard choking black teen accused shoplifting new york black voices can’t breathe young man yells security guards appear hold neck carla herreria","1","1170"
"1171","1171","https www huffingtonpost entry cheetahs chase family safari park_us_5af62829e4b00d7e4c1aba7f stalking cheetahs oblivious family scare exit car safari park world news people incredibly lucky says park spokesman mary papenfuss","1","1171"
"1172","1172","https www huffingtonpost entry brooklyn picked again_us_5af67ea3e4b0e57cd9f9b1fc brooklyn finds new home stars fans rejoice entertainment fox canceled hit comedy thursday lee moran","1","1172"
"1173","1173","https www huffingtonpost entry natural world photographs_us_5af41479e4b09bb419e539a0 incredible photos world need protect impact photographer visited planet pristine places capture images natural world laura paddison","1","1173"
"1174","1174","https www huffingtonpost entry chadwick boseman howard university graduation commencement speech_us_5af74182e4b00d7e4c1b243f chadwick boseman lauds student protesters howard commencement speech black voices black panther star shared time howard student prepared challenges faced early career hilary hanson","1","1174"
"1175","1175","https www huffingtonpost entry metoo statehouse men gone_us_5af5ed31e4b08921ee1612d3 metoo statehouse men gone harassment culture isn’t politics state lawmakers resigned expelled legislatures metoo movement started seven stateline editorial partner","1","1175"
"1176","1176","https www huffingtonpost entry frightened rabbit singer scott hutchison dead 36_us_5af59256e4b00d7e4c19d7ee frightened rabbit singer scott hutchison dead entertainment frontman body scotland day reported missing cole delbyck","1","1176"
"1177","1177","https www huffingtonpost entry sarah palin john mccain regrets_us_5af56b23e4b00d7e4c1998d2 sarah palin says mccain regrets perpetual gut punch politics sen john mccain ariz reportedly wishes chosen joe lieberman running mate willa frej","1","1177"
"1178","1178","https www huffingtonpost entry police search suspected serial killer dumping ground_us_5af4ded3e4b0e57cd9f7c2e5 police search suspected serial killer dumping ground crime michigan cops arthur ream bragged murdering people david lohr","0","1178"
"1179","1179","https www huffingtonpost entry tapper rips jerks insulting mccain_us_5af4c9bce4b00d7e4c18dcc0 jake tapper rips retired gen tom mcinerney insulting john mccain politics calls songbird john crazy people jerks i’m language carefully tapper said mary papenfuss","1","1179"
"1180","1180","https www huffingtonpost entry scott pruitt cardinal sex abuse_us_5af54e36e4b0e57cd9f82032 epa hid scott pruitt dinner climate denier accused child sex abuse politics epa knew vatican treasurer george pell investigation went ahead dinner pruitt trip italy willa frej","1","1180"
"1181","1181","https www huffingtonpost entry pat davis congress_us_5af5d9a4e4b0e57cd9f943d9 congressional candidate says f**k nra new politics pro gun policies resulted dead children dead mothers dead fathers says democratic congressional candidate pat davis amanda terkel","1","1181"
"1182","1182","https www huffingtonpost entry russia facebook ads 2016_us_5af60946e4b00d7e4c1a9a34 russian troll facebook ads barely targeted swing states politics fewer percent ads specifically targeted state contention paul blumenthal","1","1182"
"1183","1183","https www huffingtonpost entry right die advocate david goodall ends life listening ode joy_us_5af48316e4b00d7e4c1886c0 right die advocate david goodall ends life listening ode joy world news australian scientist botanist died assisted dying clinic switzerland carol kuruvilla","1","1183"
"1184","1184","https www huffingtonpost entry ryan murphy pose lgbtq organizations_us_5af47b39e4b0859d11d14f26 ryan murphy donate pose profits trans queer groups queer voices writer producer vowed ensure inclusivity extends diverse casting curtis wong","1","1184"
"1185","1185","https www huffingtonpost entry rio cops marielle francos killers_us_5af494c9e4b0e57cd9f785fb months later rio cops supposedly closing marielle franco’s killers world news investigation murder black queer rio city councilwoman right path lead police travis waldron","-1","1185"
"1186","1186","https www huffingtonpost entry police officer chokes man north carolina waffle house_us_5af49d58e4b0e57cd9f7902f officer puts man chokehold outside north carolina waffle house black voices year old violent arrest prompting questions police sara boboltz","0","1186"
"1187","1187","https www huffingtonpost entry fox business network john mccain_us_5af48276e4b0e57cd9f763cd fox business guest defends torture worked john mccain media songbird john hayley miller","0","1187"
"1188","1188","https www huffingtonpost entry dick cheney supports torture interrogation_us_5af481bde4b0e57cd9f7629e dick cheney suggests restarting torture interrogation program politics cheney comments come lawmakers scrutinized cia director nominee gina haspel role overseeing controversial program lydia connor","1","1188"
"1189","1189","https www huffingtonpost entry south carolina white supremacists black neighbor_us_5af46583e4b09bb419e5bc29 man wanted white supremacists kill black neighbor burn cross yard fbi crime brandon lecroy indicted grand jury charges murder hire hayley miller","1","1189"
"1190","1190","https www huffingtonpost entry pollen bomb explosion new jersey_us_5af42775e4b04d3b2c90f5f2 pollen bomb allergy sufferer worst nightmare weird news achoo lee moran","0","1190"
"1191","1191","https www huffingtonpost entry stormy daniels minutes fcc complaints_us_5af448b4e4b09bb419e58830 fcc complaints minutes interview stormy daniels politics kahas hit fan ashley feinberg","1","1191"
"1192","1192","https www huffingtonpost entry troy balderson ohio special election_us_5af1a332e4b0ab5c3d69f759 establishment gop notches win ohio primary vacant house seat politics ohio state sen troy balderson face democrat aug special election igor bobic","1","1192"
"1193","1193","https www huffingtonpost entry rachel crooks trump accuser wins primary_us_5af2bb37e4b0aab8a78a9bd9 trump accuser wins democratic nomination ohio legislature politics rachel crooks says trump forcibly kissed trump tower lobby willa frej","1","1193"
"1194","1194","https www huffingtonpost entry kkk leader guilty firing gun charlottesville rally_us_5af30528e4b0aab8a78b6fa2 kkk leader guilty firing gun charlottesville rally black voices video captured shooting feet black counterprotester sebastian murdock","1","1194"
"1195","1195","https www huffingtonpost entry backstreet boys dressed spice girls larger life_us_5af3266ee4b0a0d601e942e0 backstreet boys dressed spice girls larger life entertainment sang spice girls best hits jenna amatulli","0","1195"
"1196","1196","https www huffingtonpost entry andrew cuomo special prosecutor eric schneiderman_us_5af23b47e4b0a0d601e78d61 governor assigns investigation eric schneiderman abuse allegations women special prosecutor look claims attorney general physically abused women doha madani","1","1196"
"1197","1197","https www huffingtonpost entry bernie sanders revive labor unions_us_5af3556de4b0859d11d00d39 bernie sanders plan revive labor unions politics senator tells huffpost time ban right work laws easier unionize dave jamieson","0","1197"
"1198","1198","https www huffingtonpost entry trump extremism_us_5af1f96ee4b07358f8b0ff59 caliphate trump planet ruins politics extremists tomdispatch editorial partner","0","1198"
"1199","1199","https www huffingtonpost entry cynthia nixon homo cuomo_us_5af3499be4b0859d11cfedea cynthia nixon wants new yorkers vote homo cuomo queer voices nixon quipped cuomo come closet admit republican jenna amatulli","1","1199"
"1200","1200","https www huffingtonpost entry geena davis longtime 4th husband reza jarrahy divorcing_us_5af2bdb6e4b0a0d601e824f4 geena davis 4th husband reza jarrahy divorcing entertainment surgeon cited irreconcilable differences thelma louise star ron dicker","1","1200"
"1201","1201","https www huffingtonpost entry world leaders react trump iran nuclear deal_us_5af1550be4b0ab5c3d6936fb world leaders condemn trump withdrawing iran nuclear deal world news france  germany attempted ditch push trump change mind recent weeks willa frej nina golgowski","1","1201"
"1202","1202","https www huffingtonpost entry nordstrom rack president apologizes store accuses black men theft_us_5af20357e4b0a0d601e75707 nordstrom rack president apologizes store accuses black men theft black voices trio met police parking lot left store making purchase jenna amatulli","1","1202"
"1203","1203","https www huffingtonpost entry farm food stamps agricultural subsidies_us_5af20cfce4b0aab8a789eaeb farm cut food stamps friendly farmers politics gop lower income limits snap recipients raise certain agricultural subsidies arthur delaney","1","1203"
"1204","1204","https www huffingtonpost entry jimmy kimmel rudy giuliani trump_us_5af14959e4b041fd2d2a4547 jimmy kimmel tries hard sense rudy latest trump defense gives comedy brought chalkboard help mazza","-1","1204"
"1205","1205","https www huffingtonpost entry george zimmerman stalking_us_5af0c331e4b0ab5c3d68b889 george zimmerman accused stalking detective working trayvon martin film crime zimmerman appeared threaten feed investigator alligator david moye","1","1205"
"1206","1206","https www huffingtonpost entry oreilly sarah huckabee sanders_us_5af11da2e4b0ab5c3d690b95 o’reilly offers stand sarah sanders handle line reporters media tell exactly think behavior mazza","1","1206"
"1207","1207","https www huffingtonpost entry avengers matching tattoos_us_5af1d6bbe4b0ab5c3d6a949e iron man black widow captain america thor hawkeye got matching tattoos entertainment hulk want partake jenna amatulli","1","1207"
"1208","1208","https www huffingtonpost entry seth meyers perfect line confront donald trump lies_us_5af18e3be4b041fd2d2af0fa seth meyers perfect line confront donald trump lies comedy memory refresher ron dicker","-1","1208"
"1209","1209","https www huffingtonpost entry shep smith trump pulled iran deal decision violate it_us_5af22794e4b0a0d601e783d8 shepard smith trump pulled iran deal decision violate media pulling bit misnomer fox news host said rebecca shapiro","1","1209"
"1210","1210","https www huffingtonpost entry donald trump gina haspel torture_us_5af035fce4b0ab5c3d677edd trump defends gina haspel nominee cia director record torture politics qualified person woman democrats want tough terror trump tweeted monday hayley miller","1","1210"
"1211","1211","https www huffingtonpost entry columnists eyes roll far sanders play womans card haskell_us_5aefb616e4b0ab5c3d66fb64 columnist eyes roll sanders plays woman card trump cia pick politics sexist administration modern history scoffs new york times michelle goldberg mary papenfuss","1","1211"
"1212","1212","https www huffingtonpost entry john oliver rudy giuliani_us_5aefffc2e4b0ab5c3d671785 john oliver trump giuliani common gross comedy ewww mazza","1","1212"
"1213","1213","https www huffingtonpost entry cynthia nixon cuomo debate invite_us_5af0610fe4b0c4f19324c82c cynthia nixon challenges andrew cuomo televised debate politics sex city star teased candidate debate democratic race new york governor ensure hide nina golgowski","1","1213"
"1214","1214","https www huffingtonpost entry rock responds khaled_us_5af04fbde4b041fd2d28c282 rock can’t khaled’s refusal oral sex entertainment star apparently phd pleasure wants know elyse wanshel","1","1214"
"1215","1215","https www huffingtonpost entry melania trump best booklet_us_5af0c39fe4b0ab5c3d68b8b8 melania trump online safety pamphlet lifted obama administration politics new booklet kids online activity looks lots like federal trade commission released doha madani","1","1215"
"1216","1216","https www huffingtonpost entry north korea denuclearization sanctions_us_5aeeba7be4b0ab5c3d666bfb north korea says pressure reason denuclearization promise world news country accused washington misleading public opinion haejin choi hyonhee shin reuters","1","1216"
"1217","1217","https www huffingtonpost entry nra annual meeting photos_us_5aef69d7e4b0c4f19323d9d6 protests peddling presidents year nra convention politics photographer took divided scene gun group annual meeting dallas lydia connor damon dahlen","0","1217"
"1218","1218","https www huffingtonpost entry stormy daniels warns trump storms coming_us_5aee796ce4b0ab5c3d66560c real stormy daniels warns trump snl storm comin baby comedy deny climate change want mary papenfuss","1","1218"
"1219","1219","https www huffingtonpost entry ontario basic income_us_5aeac0e0e4b06748dc8fb7a5 towns trying basic income scheme changing lives impact struggling emma paling daniel tencer","1","1219"
"1220","1220","https www huffingtonpost entry david duchovny prince charles_us_5aed8a54e4b0ab5c3d65f263 time david duchovny talked booty calls prince charles entertainment saw prince charles kind looking perplexed lee moran","1","1220"
"1221","1221","https www huffingtonpost entry giuliani tells washington post trump loves me_us_5aed30abe4b0c4f19322bd59 giuliani despite stormy daniels fumble trump loves politics says president reimbursed michael cohen payment know mary papenfuss","0","1221"
"1222","1222","https www huffingtonpost entry maher sarah huckabee sanders press brief_us_5aed4921e4b041fd2d26e0f1 maher shreds baghdad bob sarah huckabee sanders bulls**t comedy point going room day lee moran","1","1222"
"1223","1223","https www huffingtonpost entry republican national committee trump midterms_us_5aec9671e4b041fd2d267033 rnc offers island pro trump optimism stormy mueller cohen sea politics gop gathered trump’s golf resort focused positives didn’t talk stuff date","1","1223"
"1224","1224","https www huffingtonpost entry try watching david beckham tear sons birthday surprise_us_5aec59aae4b041fd2d25ce50 try watching david beckham tear son birthday surprise entertainment pure cole delbyck","1","1224"
"1225","1225","https www huffingtonpost entry donald trump religious freedom rnc twitter_us_5aec0586e4b0c4f19320c60f rnc plea thank trump commitment religious freedom backfires politics happen muslim lee moran","1","1225"
"1226","1226","https www huffingtonpost entry trump religious liberty order lgbtq_us_5aec6dd4e4b041fd2d260245 trump’s new religious liberty order alarms lgbtq groups queer voices believe president new faith initiative divide discriminate curtis wong","-1","1226"
"1227","1227","https www huffingtonpost entry obama dianne feinstein_us_5aecc0e2e4b0c4f1932287c9 obama backs sen dianne feinstein faces challenge left politics feinstein leading opponent state lawmaker kevin león campaigned progressive alternative longtime democratic senator mollie reilly","0","1227"
"1228","1228","https www huffingtonpost entry elska magazine perth australia_us_5aecbbc4e4b041fd2d269f84 queer aussie men strip intimate indie magazine pictorial queer voices elska’s perth issue reveals laid late stage lgbtq community curtis wong","0","1228"
"1229","1229","https www huffingtonpost entry fox news host neil cavuto lists trumps worst lies fiery takedown_us_5aeba767e4b0ab5c3d6394b5 fox news host neil cavuto tells trump stinks fiery takedown media guess you’re busy draining swamp stop smell stink you’re creating rebecca shapiro","1","1229"
"1230","1230","https www huffingtonpost entry clay johnson attempted rape dean campaign_us_5aebb6d7e4b0c4f1932090ac accused attempted rape progressive star politics decade women alleged clay johnson leader political tech physically verbally abused molly redden","1","1230"
"1231","1231","https www huffingtonpost entry caravan mexico us_us_5aeb0695e4b022f71a05d55b half caravan asylum seekers sessions puts judges border world news dozens remain outside entrance port entry makeshift camp waiting plead case delphine schrank reuters","1","1231"
"1232","1232","https www huffingtonpost entry david bernhardt mgm lobbyists ballard partners_us_5aea362ae4b022f71a04ca40 deputy interior secretary keeps meeting lobbyists client firm politics david bernhardt met lobbyists mgm resorts oppose tribal casino interior balked approving casino chris angelo itai vardi","1","1232"
"1233","1233","https www huffingtonpost entry fema strategic plan climate change_us_5ae9d3a3e4b06748dc8e9515 fema latest excuse ignoring climate change forgot politics clears ryan grenoble","1","1233"
"1234","1234","https www huffingtonpost entry guantanamo bay prisoner transfer_us_5aeabcc6e4b06748dc8fab51 transfers guantánamo detainee trump administration politics trump pledged campaign repopulate prison saying wanted load bad dudes phil stewart reuters","1","1234"
"1235","1235","https www huffingtonpost entry trump gop tribute_us_5aeb3e81e4b041fd2d242c97 trump king party paying tribute politics rnc republican committees candidates spent nearly million donors money far hotels resorts enrich trump personally date","1","1235"
"1236","1236","https www huffingtonpost entry michael williams boy scouts nazis_us_5aeb2d0be4b0ab5c3d62c948 gop candidate connects boy scouts change caving nazism politics georgia state sen michael williams candidate governor said left wing social engineering led defeat world war lydia connor","1","1236"
"1237","1237","https www huffingtonpost entry teachers year donald trump_us_5aea3bcee4b00f70f0eeea98 nation teachers tell trump importance empathy politics said want know teach students respect empathy that’s adults need model behaviors rebecca klein","0","1237"
"1238","1238","https www huffingtonpost entry michael avenatti trump resign_us_5aea9291e4b00f70f0ef0a3d michael avenatti stunned rudy interview way trump finishes term media stormy daniels attorney says giuliani admissions doom presidency mazza","1","1238"
"1239","1239","https www huffingtonpost entry sarah huckabee sanders response michelle wolf_us_5aeb30ace4b0c4f1931fd634 sarah huckabee sanders responds michelle wolf hope happiness politics white house press secretary shot comedian jokes jenna amatulli","1","1239"
"1240","1240","https www huffingtonpost entry democrat abdul sayed michigan muslim candidates conspiracy theories_us_5aeb27f6e4b0ab5c3d62baa7 smear campaign michigan candidate shows hard muslims run office politics democrat abdul sayed ties muslim brotherhood asked foreign group daniel marans","1","1240"
"1241","1241","https www huffingtonpost entry stephen colbert donald trump 5_us_5ae9e5b3e4b06748dc8ecff0 stephen colbert parody mocks donald trump workday comedy things basically vacation ron dicker","1","1241"
"1242","1242","https www huffingtonpost entry eliza dushku reveals year journey required bring mapplethorpe big screen_us_5ae9dc1ae4b00f70f0ee5925 eliza dushku reveals year journey required bring mapplethorpe big screen queer voices work robert mapplethorpe celebrated quarters condemned immediacy working polaroids ethan alter yahoo entertainment","1","1242"
"1243","1243","https www huffingtonpost entry government anti corruption oversight_us_5ae8e4ebe4b06748dc8d4b43 corruption bad politics new proposal actually zach carter","1","1243"
"1244","1244","https www huffingtonpost entry republican food stamp bill_us_5ae9f862e4b022f71a047b9c republican food stamp cut benefits size government politics legislation plow savings new training program things arthur delaney","1","1244"
"1245","1245","https www huffingtonpost entry arkansas voter law primaries_us_5aea305ee4b00f70f0eedcb1 arkansas gets permission enforce voter law primaries politics state supreme court gave election authorities green light lower court blocked law levine","1","1245"
"1246","1246","https www huffingtonpost entry prince harry meghan markle honeymoon_us_5aea069ce4b00f70f0eea54f places prince harry meghan markle honeymoon travel royal newlyweds taylor pittman","1","1246"
"1247","1247","https www huffingtonpost entry redskins cheerleaders escorts nude photoshoot_us_5aea1e56e4b022f71a04a9dc washington nfl cheerleaders required pose nude act escorts report sports new york times report comes heels lawsuits teams cheerleaders alleging discriminatory treatment lydia connor","1","1247"
"1248","1248","https www huffingtonpost entry stephen hawking publishing new mind bending theories space_us_5ae9d963e4b06748dc8eab21 stephen hawking finished mind bending parallel universe paper days death science new treatise existence parallel universes published friday carol kuruvilla","-1","1248"
"1249","1249","https www huffingtonpost entry netanyahu speech trump israel iran_us_5ae87810e4b04aa23f2718a5 benjamin netanyahu big speech iran aimed directly trump world news pretty obvious speech audience expert said nick robins early","1","1249"
"1250","1250","https www huffingtonpost entry facebook clear history_us_5ae8dc53e4b06748dc8d39b8 facebook let users sites tracking tech able stop facebook linking browsing data account david lumb engadget","1","1250"
