"index","label","content","train","idx"
"571","571","https www huffpost entry north carolina mask law kkk_n_5ef6513dc5b6acab284180d3 masks illegal north carolina kkk inspired law politics law created prevent klux klan members wearing face masks prevent covid related mask wearing pandemic jenavieve hatch","1","571"
"572","572","https www huffpost entry george floyd died month ago protests going_n_5ef3c2c9c5b615e5cd389336 george floyd died month ago protests day politics fight justice far fact changed short time highlights historic moment alanna vagianos","0","572"
"573","573","https www huffpost entry friends reunion jennifer aniston lisa kudrow_n_5ef12be5c5b66cfbbd055037 jennifer aniston lisa kudrow dish hilarious memories filming friends entertainment actors reminisced variety actors actors issue shed little light expect sitcom reunion special josephine harvey","0","573"
"574","574","https www huffpost entry lincoln project trump tulsa rally gop_n_5ef015eac5b6f56acbc047c6 trump gop group dumps puny tulsa rally new politics lincoln project hit trump size problem new video called shrinking mary papenfuss","1","574"
"575","575","https www huffpost entry mike pence black lives matter lives matter interview_n_5eed556bc5b6c86872f8be62 pressed repeatedly black lives matter mike pence says lives matter politics philadelphia news anchor asked vice president point blank friday juneteenth he’d willing words dominique mosbergen","0","575"
"576","576","https www huffpost entry totally adorable dads need lives right now_l_5eec0f10c5b6160c4aec0d78 totally adorable dads need right parenting dance catherine pearson","1","576"
"577","577","https www huffpost entry supreme court leaves daca place dreamers_n_5ea1ad75c5b6f5350a34cec5 supreme court rules trump wrongly ended daca leaves program place politics nearly people currently protected deportation deferred action childhood arrivals program elise foley","0","577"
"578","578","https www huffpost entry stimulus check track coronavirus relief payment_l_5ee90a06c5b6f5de3031c931 stimulus check track coronavirus relief payment money check sent got need contact irs trace payment casey bond","1","578"
"579","579","https www huffpost entry safe uber lyft taxi coronavirus_l_5ee15384c5b6b74caf872e23 safe uber lyft taxi coronavirus wellness know risks cabs rideshare services amid pandemic caroline bologna","1","579"
"580","580","https www huffpost entry secret service pepper spray_n_5ee549a0c5b61a88f5516819 secret service finally admits pepper spray protesters trump church pic politics agency reversed previous claim days park police mary papenfuss","1","580"
"581","581","https www huffpost entry bachelor matt james black lead_n_5ee379dcc5b6f2cb034fbed3 matt james named black lead bachelor entertainment start overwhelmingly white lot work emma gray claire fallon","1","581"
"582","582","https www huffpost entry laurie garrett coronavirus warning_n_5ee1d753c5b6d4cbb6d08ec3 pulitzer winning pandemic reporter coronavirus far woods politics laurie garrett warned america lulled kind happy complacency crisis lee moran","-1","582"
"583","583","https www huffpost entry anderson cooper cornel west cnn_n_5ee051dbc5b61417f817cfb3 anderson cooper moved tears interview cornel west racial justice entertainment civil rights activist gave impassioned tribute george floyd family generations black families josephine harvey","1","583"
"584","584","https www huffpost entry sophie wessex megan markle prince harry exit_n_5ede5262c5b682881f717c50 royal family member meghan markle prince harry exit hope happy entertainment sophie countess wessex spoke sunday times duke duchess sussex carly ledbetter","1","584"
"585","585","https www huffpost entry best shows watch netflix june 2020_l_5ed948dac5b65ab03843836f best shows watch netflix june home living netflix new cooking competition crazy delicious todd van luling","1","585"
"586","586","https www huffpost entry crew mark short covid pharma stocks_n_5edb26a9c5b6a80a46d45c81 watchdog calls fbi probe medical pharma stock holdings pence chief staff politics marc short participated personally substantially particular matters affecting companies holds stock according complaint mary papenfuss","-1","586"
"587","587","https www huffpost entry alex vitale american policing enforcing white supremacy_n_5ed934c2c5b69dee016ed79e american policing enforcing white supremacy politics police scholar author alex vitale gives thorough explainer history police forces got moment radical reimagining future emma gray","1","587"
"588","588","https www huffpost entry best places buy seafood online_l_5ed575f0c5b69c8764870889 best places buy seafood online including fresh frozen fish home living order fish seafood online grocery store floundering danielle gonzalez","1","588"
"589","589","https www huffpost entry seth rogen black lives matter_n_5ed6284dc5b6ccd7c56b8277 seth rogen bomb destruction black lives matter foes divine entertainment long shot actor posted black lives matter sign instagram amid george floyd protests gave letter send disagrees ron dicker","1","589"
"590","590","https www huffpost entry washington protests white house_n_5ed33b67c5b6921167ee92ff protesters converge white house second straight day news police wore tactical gear  national guard blockaded protesters ashraf khalil kevvin freking michael balsamo ","1","590"
"591","591","https www huffpost entry louisiana fossil fuel protests slave cemetery_n_5ed197d8c5b6eb7566d758d9 louisiana mandate year minimum sentence trespassing fossil fuel sites politics legislation inflict harsh new punishments black protesters opposing massive complex plastics plants likely slave burial grounds alexander kaufman","0","591"
"592","592","https www huffpost entry conservative radio coronavirus limbaugh fox trump_n_5ec29324c5b637e3d2d33e04 right wing radio reaches tens millions coronavirus conspiracies control politics talk radio hosts like rush limbaugh spread wild misinformation virus defend trump botched response pandemic nick robins early","1","592"
"593","593","https www huffpost entry trump reporter mask politically correct coronavirus_n_5ecdc23fc5b6141aaf1bc7cb trump taunts reporter wearing mask white house news conference politics trump mocked journalist politically correct wearing face covering prevent spread coronavirus mazza","1","593"
"594","594","https www huffpost entry trump tweets twitter label fact check_n_5ecd96adc5b6374866e8be11 twitter applies fact check labels trump tweets time politics president accused platform stifling free speech added link reports debunking tweets mail ballots leading fraud josephine harvey","1","594"
"595","595","https www huffpost entry kayleigh mcenany trump barack obama golfing covid 19_n_5ecae75ac5b6065ca9f094c2 white house press secretary golf mourns trump exempt politics kayleigh mcenany talking barack obama donald trump referring death journalist daniel pearl obama illinois state senator mary papenfuss","1","595"
"596","596","https www huffpost entry ken jennings parenting tweets_l_5ebe132fc5b6c9c18741ba92 funny relatable parenting tweets ken jennings parenting jeopardy champion children wife mindy caroline bologna","1","596"
"597","597","https www huffpost entry goldie hawn coronavirus crying_n_5ec7e0d3c5b68235c5b291f0 goldie hawn says coronavirus sadness makes times day entertainment laughingchallenge creator says feels terrible thinking abuse anger happening people confinement jenna amatulli","1","597"
"598","598","https www huffpost entry children clinginess separation anxiety covid 19_l_5ec42f8bc5b66aed0c277db7 reason kids clingy right parenting toddlers teens alike leave parents  deal catherine pearson","0","598"
"599","599","https www huffpost entry trump china reversal coronavirus blame_n_5ec44c7bc5b61e42ad3d8876 trump hopes forget praised china blaming politics months president applauded china’s coronavirus response reelection team flipped blaming country date","-1","599"
"600","600","https www huffpost entry theodore roosevelt sailors positive coronavirus retest_n_5ec17c00c5b6070781a2e99d sailors uss theodore roosevelt test positive covid reportedly recovering news sailors returned duty aircraft carrier previously testing negative taken ship han jones","1","600"
"601","601","https www huffpost entry honking truck protesters trump love claim_n_5ebf0f39c5b61c0258d6e24e honking truckers showing trump love president claims briefing weren politics protesters demanding help federal government covid crisis shipping rates plunge mary papenfuss","0","601"
"602","602","https www huffpost entry chris christie whoopi goldberg sacrifice_n_5ebebcf4c5b683c6d7132f71 whoopi goldberg asks chris christie willing sacrifice reopen economy politics new jersey governor told view friday lives going lost inevitably matter david moye","0","602"
"603","603","https www huffpost entry matt damon daughter alexia coronavirus_n_5ebc5fd1c5b6dfbab781f946 matt damon says daughter alexia covid got fine entertainment bourne identity star family currently living ireland plan reunite year old end month curtis wong","1","603"
"604","604","https www huffpost entry dakota johnson bangs marie claire_l_5ebaa40bc5b69b20b701d522 warning dakota johnson cover shoot induce quarantine bangs style beauty won cut bangs coronavirus pandemic won cut bangs won cut bangs jamie feldman","1","604"
"605","605","https www huffpost entry steve mnuchin unemployment rate percent_n_5eb7fdf0c5b69c4b317c3e14 steve mnuchin actual unemployment rate close politics rate joblessness estimated peaked worst great depression hayley miller","1","605"
"606","606","https www huffpost entry alexandria ocasio cortez animal crossing gop critic_n_5eb691aec5b69c4b317b0831 ocasio cortez hits gop critic animal crossing gaming question trump politics new york lawmaker brought president golfing habits response lee moran","1","606"
"607","607","https www huffpost entry coronavirus hate crimes asian racism anti semitism_n_5eb55644c5b6a673354150af congressional democrats tell doj address covid hate crimes politics attacks skyrocketed asians asian americans coronavirus pandemic federal response fallen short lawmakers said marina fang","1","607"
"608","608","https www huffpost entry adele birthday coronavirus workers praise_n_5eb26cc1c5b62ca6fb2de9f6 adele celebrates 32nd birthday praising coronavirus worker angels entertainment hello singer shared rare new picture signaled lee moran","1","608"
"609","609","https www huffpost entry long recover coronavirus_l_5eb18ee0c5b62b850f92a93e long recover coronavirus wellness experts know recuperating symptoms mild severe cases covid lindsay holmes","-1","609"
"610","610","https www huffpost entry george bush donald trump covid unity impeachment_n_5eaf3db6c5b69a7955199cea trump bashes george bush unity covid crisis politics unity mary papenfuss","1","610"
"611","611","https www huffpost entry boris johnson son wilfred doctors_n_5eada215c5b6e74234479d4a boris johnson son named doctors saved life covid world news british prime minister fiancee carrie symonds welcomed wilfred lawrie nicholas johnson family month ","1","611"
"612","612","https www huffpost entry alex jones cannibalism covid 19_n_5eac56e7c5b624b39692b1f2 alex jones says considering eating neighbors covid lockdown continues weird news i’m ready hang gut skin infowars conspiracy theorist said neighbors david moye","1","612"
"613","613","https www huffpost entry sarah michelle gellar quarantine pink hair_n_5ea9788fc5b6106b8ed05662 sarah michelle gellar dyed hair pink embarrass kids entertainment buffy actor revealed new quarancolor tuesday stars making creative use coronavirus isolation curtis wong","1","613"
"614","614","https www huffpost entry mothers day cards social distancing_l_5ea70c02c5b6a30004e6272c mother day cards sum social distancing parenting spot cards capture sentiments surrounding mother day caroline bologna","1","614"
"615","615","https www huffpost entry asteroid face mask_n_5ea60b5ac5b6805f9ecf4add scientists note asteroid approaching earth looks like it’s wearing face mask science or2 appears know planet facing coronavirus pandemic researchers joked josephine harvey","1","615"
"616","616","https www huffpost entry new jersey special education online services waiver coronavirus_n_5ea4637ec5b6d3763590790c access online services new jersey students disabilities promise sue politics special education groups taking issue waivers schools districts necessary unprecedented time rebecca klein","1","616"
"617","617","https www huffpost entry parenting equipped queer families handle coronavirus pandemic_l_5ea2e355c5b669fd892351bd parenting equipped queer families handle coronavirus pandemic parenting multi household families drawing resiliency comes living margins brianna sharpe","1","617"
"618","618","https www huffpost entry lululemon racist bat fried rice anti asia_n_5ea05770c5b6a486d08285c5 lululemon apologizes art director post racist bat fried rice shirt business athletic apparel brand said offensive shirt wasn product executive promoted instagram longer employee jenna amatulli","0","618"
"619","619","https www huffpost entry long distance mothers day gifts_l_5e9db1c3c5b63c5b58722a00 best long distance mother day gifts moms far away home living near mom love gifts won feeling far away mother day ambar pardilla","1","619"
"620","620","https www huffpost entry tom hanks rita wilson coronavirus symptoms_n_5e9d1d3dc5b635d25d6f16cc tom hanks details tougher coronavirus struggle rita wilson entertainment hanks wilson diagnosed covid australia mazza","1","620"
"621","621","https www huffpost entry movie musicals watch coronavirus_n_5e94989ec5b6d97d91f0f224 movie musicals brighten dimming spirit entertainment lockdown living tough luckily little song dance cure blues leigh blickley","0","621"
"622","622","https www huffpost entry coronavirus distraction_l_5e98b4a2c5b6a92100e45b0d coronavirus things obsess weekend style beauty drunk martha stewart leggings pockets jamie feldman","1","622"
"623","623","https www huffpost entry land lakes dumps native america mascot_n_5e978a28c5b6a92100e1a900 land lakes removing native american woman packaging years business photos members farmer owned cooperative replace logo david moye","-1","623"
"624","624","https www huffpost entry solutions coronavirus climate change same_n_5e908f19c5b6260471e0d840 solutions coronavirus climate change impact protecting environment healthier withstand pandemic prevent amanda schupak","0","624"
"625","625","https www huffpost entry coronavirus inequalities food marion nestle_n_5e82f437c5b6d38d98a40c8e coronavirus reveals invisible inequalities food impact professor marion nestle offers sobering assessment food failing given tom levitt","0","625"
"626","626","https www huffpost entry fda alex jones stop selling fake coronavirus cures_n_5e91e4a8c5b69d65062a09da fda alex jones stop selling fake coronavirus cures news conspiracy theorist hawking unapproved unauthorized products falsely claim combat covid agency said sebastian murdock","1","626"
"627","627","https www huffpost entry clean fabric coronavirus face mask_l_5e8f6e5dc5b6458ae2a5cab1 clean fabric coronavirus face mask style beauty washing face masks important wearing prevent spread covid vartika puranik","1","627"
"628","628","https www huffpost entry shirt face mask coronavirus_l_5e8f2f06c5b6b371812d15af coronavirus face mask shirt style beauty different ways sew sew homemade cloth face mask shirts time covid pandemic kristen aiken","1","628"
"629","629","https www huffpost entry randy rainbow coumosexual covid love song andrew cuomo andy_n_5e8ba672c5b6e1d10a687332 randy rainbow cuomosexual covid love song new york governor entertainment youtube star’s viral parody andy thanks andrew cuomo daily press briefings elyse wanshel","1","629"
"630","630","https www huffpost entry walking dead finale cats_n_5e86348dc5b63e06281af89d walking dead facto season finale cat astrophe entertainment new villain zombie kitten bradley","1","630"
"631","631","https www huffpost entry deutsche bank trump debt help coronavirus conflict interest_n_5e87ee89c5b6cc1e47758499 trump org reportedly seeking debt help deutsche bank probed doj politics white house ethics chief walter shaub called absolute nightmare warned mary papenfuss","1","631"
"632","632","https www huffpost entry coronavirus makes inequality worse change that_n_5e864af5c5b6d302366d1173 coronavirus absolutely inequality worse change impact covid pandemic inconvenience says lehman brothers executive  it’s life death kyla mandel","0","632"
"633","633","https www huffpost entry jimmy kimmel coronavirus april fools day_n_5e8439ddc5b65dd0c5d67c36 jimmy kimmel offers hilariously terrible coronavirus april fools pranks entertainment late night talk host shared simple ways torment loved ones age social distancing mazza","1","633"
"634","634","https www huffpost entry stop tantrums kids_l_5e822d54c5b66ea70fda8084 simple game stop tantrums parenting f*ck kids author lindsay powers details expert approved tips putting end bad behavior kate auletta","1","634"
"635","635","https www huffpost entry changes coming huffpost comments_n_5e552ae5c5b65e0f11c71104 changes coming huffpost comments media join membership comment huffpost articles starting week jennifer kho","0","635"
"636","636","https www huffpost entry doris burke coronavirus nba_n_5e7f5facc5b6256a7a2b9af4 doris burke nba analyst espn reveals tested positive coronavirus media basketball analyst detailed symptoms recent podcast interview kimberley richards","1","636"
"637","637","https www huffpost entry funniest tweets women march 28_n_5e7d01a3c5b6cb9dc19cc7cb funniest tweets women week march women understand retired people eat dinner early hollis miller","0","637"
"638","638","https www huffpost entry jimmy kimmel donald trump pino nickname_n_5e7c8ea3c5b6256a7a2569a6 jimmy kimmel gives savage new nickname trump coronavirus era entertainment talk host kept hilarious offensive wartime president ron dicker","1","638"
"639","639","https www huffpost entry face mask coronavirus_l_5e78cb2fc5b6f5b7c5483e17 coronavirus face masks effective style beauty diy tutorials sew homemade masks protect covid wearing mask donating hospitals kristen aiken","-1","639"
"640","640","https www huffpost entry president slovakia coronavirus mask_l_5e78d0b5c5b62f90bc4e9cfa president slovakia nailed coronavirus look style beauty twitter users referred zuzana čaputová matching outfit face mask included corona drip jamie feldman","1","640"
"641","641","https www huffpost entry rita wilson rapping coronavirus_n_5e77dd66c5b6f5b7c54687d5 watch quarantine stir crazy rita wilson rap minutes straight entertainment actor husband tom hanks self isolating testing positive coronavirus josephine harvey","1","641"
"642","642","https www huffpost entry living coronavirus_l_5e729252c5b6f5b7c53d9a6d live coronavirus wellness stuck home partner kid roommate coronavirus symptoms care brittany wong","1","642"
"643","643","https www huffpost entry packages coroonavirus_l_5e7375cbc5b6f5b7c53f3562 open clean delivery packages coronavirus pandemic home living stop heard hand washing involved maija kappler","0","643"
"644","644","https www huffpost entry ana armas shares photos taken personal photographer ben affleck_n_5e7252ecc5b6eab77940c902 ana armas shares photos taken personal photographer ben affleck entertainment stars took rumored romance instagram cole delbyck","1","644"
"645","645","https www huffpost entry franklin boone american idol audition_n_5e6face4c5b6eab77939e1c7 franklin boone blows away american idol compared phenom entertainment katy perry called season lionel richie said total package ron dicker","1","645"
"646","646","https www huffpost entry erin brockovich julia roberts susannah grant_n_5e6ba01ec5b6bd8156f6467c erin brockovich rewatchable movies entertainment julia roberts gives best performance career aided sassy susannah grant script liners matthew jacobs","1","646"
"647","647","https www huffpost entry serena williams self isolate coronavirus_n_5e6cab07c5b6747ef11da2db serena williams alexis ohanian announce lengthy isolation amid coronavirus crisis entertainment tennis star williams wrote instagram it’s going hard we’ll persevere added ohanian lee moran","0","647"
"648","648","https www huffpost entry coronavirus cruise ship risk_l_5e693e9ac5b6bd8156f0ca60 cruise lines paying customers cancel despite coronavirus risk money risk health potentially life freebies casey bond","1","648"
"649","649","https www huffpost entry panic buying coronavirus_l_5e67932bc5b6670e72fee693 psychology panic buying avoid money people stockpiling panic buying toilet paper pasta canned goods hand sanitizer soap impact having natasha hinde","1","649"
"650","650","https www huffpost entry surgeon general dodges coronavirus question praises trump health_n_5e65382cc5b6670e72f9cb4a surgeon general dodges coronavirus question praises trump health interview news jerome adams complimented trump health offered little information tested coronavirus han jones","1","650"
"651","651","https www huffpost entry new york coronavirus state emergency_n_5e63f95cc5b68d6164553ee7 new york state coronavirus cases jump cuomo declares state emergency news cases covid new york concentrated state westchester county ","-1","651"
"652","652","https www huffpost entry american dirt critics oprah winfrey jeanine cummins_n_5e604be9c5b69d641c0a58b1 critics american dirt confront author oprah special news jeanine cummins oprah winfrey sit critics discuss marginalization latinx voices hillel italie ","1","652"
"653","653","https www huffpost entry ice covers homes lake erie hoover beach hamburg new york_n_5e5d3515c5b6732f50e5fb9d lake erie homes look surreal encased ice storm news looks fake looks unreal resident living hoover beach neighborhood hamburg new york elyse wanshel","1","653"
"654","654","https www huffpost entry mad mike hughes flat earth_n_5e597924c5b60102211080c8 spectacular finale mad mike news mad mike hughes representative current warped political social economic times justin chapman","0","654"
"655","655","https www huffpost entry buy groups_l_5e56b6b7c5b62e9dc7dbc2c9 buy groups stop spending money ask need money facebook groups prohibit exchanging money bartering reduce waste build communities casey bond","1","655"
"656","656","https www huffpost entry brazil coronavirus case_n_5e568e36c5b649ec43313b02 brazil confirms coronavirus case latin america world news year old man contracted virus week work trip italy according brazil health ministry marcelo sousa david biller ","1","656"
"657","657","https www huffpost entry hiker crawl hours olympic peninsula_n_5e543c7fc5b65e0f11c51b6e runner broken leg crawls hours wilderness help news joseph oldendorf knees bloodied raw crawling said thought family kept moving josephine harvey","1","657"
"658","658","https www huffpost entry lay case julian assange extradition hearing_n_5e529cb1c5b6a4525dbc9792 lay case julian assange extradition hearing news monday lawyers deliver arguments court hoping extradite wikileaks founder faces espionage charges ","1","658"
"659","659","https www huffpost entry iran missiles inflicted brain injuries troops_n_5e4fac68c5b6a4525db96cff hit truck iran missiles inflicted brain injuries troops world news soldiers diagnosed traumatic brain injuries wake jan missile attack phil stewart idrees ali reuters","-1","659"
"660","660","https www huffpost entry mississippi jackson flooding_n_5e4cdccdc5b6eb8e95b4d41b mississippi braces rain hundreds homes flooded jackson area news gov tate reeves warned mississippians state clear dominique mosbergen","-1","660"
"661","661","https www huffpost entry diamond princess passengers positive coronavirus_n_5e4aa1d4c5b64433c619ad64 people evacuated japan test positive coronavirus news individuals tested negative virus evacuated quarantined diamond princess cruise ship officials said monday nina golgowski","-1","661"
"662","662","https www huffpost entry kobe bryant basketball hall fame_n_5e47398bc5b64d860fcaefb9 kobe bryant finalists basketball hall fame sports finalists include tim duncan kevin garnett ","1","662"
"663","663","https www huffpost entry astronaut christina koch reunites dog_n_5e45b913c5b64433c6135339 nasa astronaut reunites dog days space news christina koch pup absolutely owner record setting stint away earth josephine harvey","1","663"
"664","664","https www huffpost entry ohio state football players accused rape kidnapping_n_5e43bc3dc5b6d0ea381099c8 ohio state football players accused rape kidnapping news police charged defensive players amir riep jahsen  warrants issued arrests ","0","664"
"665","665","https www huffpost entry team beijing coronavirus_n_5e40be0ec5b6bb0ffc13ccea china’s coronavirus infections sends advance team beijing world news china reportedly ignored offers help world health organization cdc recently nick visser","1","665"
"666","666","https www huffpost entry trump weld walsh new hampshire_n_5e3dd8e2c5b6b70886ffecb8 trump single challenger republican primaries politics massachusetts gov weld left fighting trump illinois congressman joe walsh dropped date","1","666"
"667","667","https www huffpost entry ballak sissoko kora mali tsa_n_5e3d01b1c5b6f1f57f0e6d60 renowned african musician accuses tsa wrecking instrument news tell attitude administration african musicians asked post kora player ballaké sissoko facebook page mary papenfuss","1","667"
"668","668","https www huffpost entry california pause student fitness tests years bullying_n_5e3a99d6c5b670682954432f california pause student fitness tests years bullying news state received complaints test discriminates disabled non binary students ","1","668"
