"index","label","content","train","idx"
"0","0","link headline category short_description authors date","1","0"
"1","1","https www huffpost entry puerto rico water hurricane fiona_n_632bdfd8e4b0d12b54014e13 puerto ricans desperate water hurricane fiona’s rampage world news half million people remained water service days storm lashed territory dánica coto ","0","1"
"2","2","https www huffpost entry valery polyakov dies_n_6329d497e4b0913a3dd5336c russian cosmonaut valery polyakov broke record day stay space dies world news polyakov record breaking trip outer space saw orbit earth times travel nearly million miles marco margaritoff","1","2"
"3","3","https www huffpost entry national championship air races pilot killed crash_n_632860fae4b0ed021dfef140 dead plane crashes reno air race news single engine plane participating national championship air races sunday crashed field killing pilot officials said nina golgowski","0","3"
"4","4","https www huffpost entry census falsified inspector general finds_n_63277879e4b046aa02406f26 watchdog report finds census takers fudged data didn’t fired news despite entering false information work wasn redone fully cases census takers received bonuses office inspector general reported ","1","4"
"5","5","https www huffpost entry blade runner series announced_n_63247adfe4b027aa40656cc0 amazon greenlights blade runner limited series produced ridley scott entertainment director original film joins writer sequel newest installment sci franchise marco margaritoff","1","5"
"6","6","https www huffpost entry viola davis woman king heart attack_n_6322f795e4b000d988585229 viola davis feared heart attack woman king training entertainment oscar winner said worked hours day role new action movie marco margaritoff","0","6"
"7","7","https www huffpost entry tiktok misinformation_n_6321c9b0e4b027aa40614814 tiktok search results riddled misinformation report tech firm monitors false online claims reports searches information prominent news topics tiktok likely turn results riddled misinformation david klepper ","-1","7"
"8","8","https www huffpost entry democratic primary rhode island retiring_n_631d6772e4b0eac9f4d81d5a electability ballot key rhode island house primary politics democrats state’s moderate house district deciding popular republican mayor daniel marans","-1","8"
"9","9","https www huffpost entry russia ukraine war nuclear plant reactor stopped_n_631dc78de4b082746be0b33c reactor ukraine zaporizhzhia nuclear plant stopped world news plant biggest atomic power stations world occupied russian forces early war marked 200th day sunday karl ritter ","-1","9"
"10","10","https www huffpost entry kelly derrel mcdavid trial_n_631ac084e4b0eac9f4d5ac29 employee testifies doubts kelly abuse denials entertainment derrell mcdavid’s testimony major blow singer hope acquittal michael tarm ","1","10"
"11","11","https www huffpost entry portland disabled lawsuit blocked sidewalks_n_631a741fe4b046aa0232f7c6 portland residents disabilities sue city blocked sidewalks politics lawsuit says allowing homeless people’s tents block city sidewalks makes difficult people wheelchairs walkers canes use claire rush ","1","11"
"12","12","https www huffpost entry fairview california_n_6316e991e4b0536be048168d fast moving fairview kills california news second killed people northern california weekend nick visser","1","12"
"13","13","https www huffpost entry cloudflare kiwi farms_n_6315993ae4b0eac9f4ce0ba1 citing imminent danger cloudflare drops hate site kiwi farms tech cloudflare ceo matthew prince previously resisted calls block site associated press ","-1","13"
"14","14","https www huffpost entry georgia flash flooding_n_63151514e4b0eac9f4cdc7d3 emergency declared flash flooding hits northwest georgia news thunderstorms heavy rain pounded parts northwest georgia sunday sparking flash flooding dangerously high waters areas ","1","14"
"15","15","https www huffpost entry putin snubs gorbachev funeral_n_6312499ce4b09e34c39504ef putin plans snub gorbachev funeral world news low key funeral reflects kremlin’s uneasiness legacy gorbachev despised home collapse soviet union jim heintz vladimir isachenkov ","1","15"
"16","16","https www huffpost entry lisa loeb 90s music profile_n_630d2734e4b088f74236a534 lisa loeb paved way 90s rare feat independent artists time culture arts stay missed artist reflects pushing culture female singer songwriters expected fit certain mold big candice frederick","0","16"
"17","17","https www huffpost entry nasa artemis moon mission_n_630d7530e4b063d5e61e0179 safety nasa reschedules artemis moon mission saturday science we’re going play innings artemis mission manager said launch scrubbed nick visser","-1","17"
"18","18","https www huffpost entry johnny depp surprise appearance vmas_n_6306d231e4b035629c01235e johnny depp makes surprise appearance moon person mtv vmas entertainment actor camera appearance defamation verdict wife amber heard june ben blanchet","1","18"
"19","19","https www huffpost entry donald trump dick pic fbi serach affidavit_n_63097b47e4b063d5e61b9a20 posts dick pic dad affidavit release redact politics hang president goofs die hard fan mary papenfuss","-1","19"
"20","20","https www huffpost entry canberra kangaroo fight_n_6308360fe4b0da54bade11aa finish fighting kangaroo pulls wild right video game weird news mad marsupials went canberra nature reserve mazza","1","20"
"21","21","https www huffpost entry markwayne mullin wins oklahoma repubican primary senate_n_63054959e4b0f72c09dbbb56 markwayne mullin wins oklahoma republican primary succeed gop sen jim inhofe politics term house member known staunch president biden critic loyal donald trump supporter jonathan nicholson","1","21"
"22","22","https www huffpost entry rusty bowers trump giuiani gop election coup arizona_n_630405b8e4b0e323a257fcd2 rusty bowers rips fascism gop trump strong arm tactics trash vote politics haven’t hanged arizona gop leader told guardian powerful interview holy moly crazy place lost mind mary papenfuss","1","22"
"23","23","https www huffpost entry united states minneapolis teacher layoff policy_n_63027570e4b0f7df9bb15459 minneapolis teacher contract race language ignites firestorm education minneapolis teachers settled day strike earlier year celebrated groundbreaking provision new contract meant shield teachers color traditional seniority based layoffs steve karnowski ","0","23"
"24","24","https www huffpost entry dorli rainey symbol occupy movement dies 95_n_63015837e4b00c150d620b37 dorli rainey symbol occupy movement dies news seattle activist turned racial justice affordable housing anti war demonstrations years ","1","24"
"25","25","https www huffpost entry media ask judge release trump search warrant affidavit_n_62fdf830e4b0638948305107 media ask judge release trump search warrant affidavit politics matter utmost public involving actions current government officials wrote attorney media companies terry spencer ","1","25"
"26","26","https www huffpost entry general motors seatbelt issue recall_n_62fc7a97e4b0f48a02027959 general motors recalls vehicles improperly formed seat belts news automaker said aware crashes injuries result seat belts ","-1","26"
"27","27","https www huffpost entry tiger woods golf player meeting_n_62fbeafae4b077bb77a6703c tiger meet players liv golf sports pga tour delaware time tiger woods doug ferguson ","1","27"
"28","28","https www huffpost entry israel palestinian gunman jerusalem shooting_n_62f8e0a5e4b0288b61a569f9 palestinian gunman wounds late night jerusalem shooting world news attack jerusalem followed tense week israel palestinians gaza west bank ilan ben zion ","0","28"
"29","29","https www huffpost entry nfl player panthers stops fight_n_62f749dde4b0ab35e0b34afc video shows nfl player hopping stands stop fighting fans sports moore cameo took place fan fest event organized carolina panthers ben blanchet","1","29"
"30","30","https www huffpost entry wisconsin police wild turkey chase_n_62f4951ee4b0288b61a18acc feathers fly wild turkey dodges cops slapstick apartment chase weird news officer net attempt nab turkey shuffled apartment friday ben blanchet","1","30"
"31","31","https www huffpost entry stranded whale seine river moved saltwater_n_62f37113e4b0acf9d0033e8e stranded whale euthanized removal french river world news veterinarian said rescue operation dangerously white mammal began breathing difficulties ","1","31"
"32","32","https www huffpost entry narcotics anonymous shooting_n_62f2955ce4b0db71d8ccb4e9 dead shooting florida narcotics anonymous meeting news man went meeting killed girlfriend friend shooting police ","0","32"
"33","33","https www huffpost entry ezra miller controversies flash_n_62ef5649e4b09fecea4ead75 flash movie set release despite ezra miller controversies entertainment warner bros discovery ceo david zaslav recently teased film upcoming release spite miller arrests allegations star ben blanchet","1","33"
"34","34","https www huffpost entry zachary alligator new york_n_62ee9555e4b09fecea4e863b new york couple turns foot gator zachary keeping home environment zachary headed sanctuary better life ahead hilary hanson","0","34"
"35","35","https www huffpost entry fbi arrests lousville cops breonna taylor_n_62ebd8abe4b0ecfe3f6e79f7 fbi arrests louisville cops breonna taylor shooting investigation news officers accused false information obtain search warrant led taylor killing ryan grenoble","1","35"
"36","36","https www huffpost entry paul pelosi dui plea_n_62eaac2ce4b09d09a2c02cb0 paul pelosi pleads guilty dui charges politics husband house speaker nancy pelosi charged driving influence car crash california ","0","36"
"37","37","https www huffpost entry rusty bowers donald trump arizona gop_n_62e7a6fbe4b00fd8d8411100 arizona rusty bowers comes trump bid politics state house speaker testified jan committee investigating trump efforts cling power marita vlachou","1","37"
"38","38","https www huffpost entry league super pets takes million_n_62e6acd4e4b07f8376702fd3 league super pets takes million entertainment superhero spinoff superman’s dog knocked jordan peele’s nope second place lindsey bahr ","0","38"
"39","39","https www huffpost entry nicholas sandmann loses defamation lawsuits_n_62e414bfe4b0c60a5667fb1e covington kid nicholas sandmann loses defamation suits major media outlets news sandmann footage native american elder went viral lost outlets including new york times abc news marco margaritoff","-1","39"
"40","40","https www huffpost entry chris cuomo newsnation host_n_62e0a01de4b081f3a9052a45 chris cuomo returning cable news cnn ouster media head cnn taken job prime time host newsnation josephine harvey","1","40"
"41","41","https www huffpost entry steve bannon shock troops deconstructing government brick brick_n_62df1131e4b0aad58d1e13ca steve bannon calls shock troops deconstruct government brick brick politics incendiary rhetoric nation days contempt congress conviction mary papenfuss","1","41"
"42","42","https www huffpost entry biden covid improves_n_62dda60ae4b0a6852c38f22d biden improves significantly throat sore covid politics president joe biden physician kevin connor says biden continues improve significantly despite lingering sore throat chris megerian ","0","42"
"43","43","https www huffpost entry chelsea handler joy koy split_n_62daac93e4b06e213fbe7d1b chelsea handler ending relationship koy choose entertainment comedy star confessed koy experiencing issues time carly ledbetter","1","43"
"44","44","https www huffpost entry biden climate executive orders agenda stalls_n_62d75058e4b0a6852c30c61b biden takes modest executive action climate agenda stalls congress politics executive push includes billion climate resilience funding step opening gulf mexico offshore wind development chris angelo","1","44"
"45","45","https www huffpost entry indiana mall shooting food court_n_62d4af0be4b0116f21bd36e7 killed gunman opens indiana mall food court politics police said man rifle opened food court armed civilian shot injured associated press ","1","45"
"46","46","https www huffpost entry jak knight comedian big mouth writer actor dies_n_62d43aade4b0f6913031025c jak knight stand comedian big mouth writer actor dies entertainment comedian recently created starred peacock bust died thursday cole delbyck","0","46"
"47","47","https www huffpost entry dave coulier oughta know alanis morissette_n_62d17eb5e4b04aa0fe672fe9 dave coulier recalls hearing alanis morissette oughta know time entertainment house star revealed big clue musician singing jagged little pill album hilary hanson","1","47"
"48","48","https www huffpost entry biden admin pharmacists refuse prescriptions similar medication abortion_n_62cefd0de4b0e6251b381293 biden admin pharmacists refuse prescriptions similar medication abortion politics fall roe pharmacies refused certain prescriptions similar drugs medication abortion alanna vagianos","0","48"
"49","49","https www huffpost entry emmy nominations snubs surprises_n_62cdb4d9e4b02e0ac91a6cce snubs surprises emmy nominations culture arts huge showing abbott elementary complete shut pachinko huffpost breaks year emmy nominations marina fang elyse wanshel erin evans candice frederick","0","49"
"50","50","https www huffpost entry resurgence american girl doll core_n_62c50476e4b0aa392d37abcd resurgence american girl doll core culture arts women viral american girl themed meme pages dolls rallying series unfortunate historical events we’ve living ruth etiesit samuel","1","50"
"51","51","https www huffpost entry gun control social media_n_62c81c21e4b0d74019828968 gun applicants soon social media accounts screened politics new york state rolling novel strategy screen applicants gun permits marina villenueve maysoon khan ","1","51"
"52","52","https www huffpost entry safe swim eating_l_62bf2110e4b065b10ad43bcd safe swim right eating experts good news food drink told wait minutes eating jumping pool let dig  taylor tobin","1","52"
"53","53","https www huffpost entry jello skin tiktok_l_62b5bc22e4b04a6173695b03 jello skin latest tiktok skin care trend achieve style beauty jell bouncy jiggly snaps slightest movement according latest tiktok trend skin way rebecca rovenstine","1","53"
"54","54","https www huffpost entry crosby stills nash spotify joe rogan_n_62c1379ee4b0ffe00a12cb32 crosby stills nash music returns spotify joe rogan protest entertainment band members asked spotify remove music february following neil young protest podcaster joe rogan ben blanchet","0","54"
"55","55","https www huffpost entry funniest tweets women week june july 1_n_62bf4f5ce4b00a9334e80462 funniest tweets women week june july women sending friends tweets think like thing crows leave little gifts bottle caps string brittany wong","1","55"
"56","56","https www huffpost entry meghan markle supreme court roe wade_n_62b5c890e4b06169caa5e656 meghan markle weighs supreme court decision overturn roe news consequences impact meghan said husband talked lot past days he’s feminist carly ledbetter","1","56"
"57","57","https www huffpost entry mariah carey latto bet awards performance_n_62b913bae4b0c77098be0ee2 mariah carey brings big big energy latto bet awards performance black voices queen christmas joined queen souf stage year award ceremony ruth etiesit samuel","1","57"
"58","58","https www huffpost entry foot alligator man dead myrtle beach south carolina_n_62b7d7a2e4b04a61736b6c7b man killed foot alligator south carolina pond environment giant reptile captured euthanized site mary papenfuss","1","58"
"59","59","https www huffpost entry steve bannon woke army awakened qanon jan committee_n_62b5d66ae4b06594c1e39ce8 bashing woke americans steve bannon hails trump backing army awakened politics wake steve awakened woke mary papenfuss","1","59"
"60","60","https www huffpost entry chipper truck cafe grubhub hostage_n_62b38196e4b04a617365121e woman allegedly held hostage gets rescued thanks grubhub note crime woman placing order asked restaurant employees police come delivery don’t obvious david moye","1","60"
"61","61","https www huffpost entry dave chappelle turns high schools offer theater him_n_62b1ee0ee4b0cdccbe635720 dave chappelle rejects high school’s offer theater amid controversy entertainment comedy star said criticism duke ellington school arts students sincerely hurt jazmin tolliver","-1","61"
"62","62","https www huffpost entry pharrell williams pays offf student debt naacp_n_62ae576ee4b04a61735d2f08 happy pharrell williams pays student debt naacp youth leaders news pharrell forever changed lives said naacp official hoping president biden action student debt mary papenfuss","0","62"
"63","63","https www huffpost entry funniest parenting tweets_l_62abdd4be4b0c77098abed6a funniest tweets parents week june parenting kid told deserved cheese argue caroline bologna","1","63"
"64","64","https www huffpost entry obama daca anniversary americano musical_n_62a7a5dae4b0cdccbe540672 obama marks daca’s 10th anniversary conversation dreamers politics president spoke daca recipients stage musical ¡americano based life dreamer political organizer tony valdovinos marina fang","-1","64"
"65","65","https www huffpost entry yellowstone national park flooding_n_62a7de48e4b04a617353121a yellowstone floods wipe roads bridges strand visitors environment flooding wiped roads bridges closed entrances yellowstone national park onset busy summer tourist season amy beth hanson ","0","65"
"66","66","https www huffpost entry iced coffee hacks_l_629e0c27e4b0c184bdd38c40 easy ways save money order iced coffee food drink iced coffee drinks rip terms cost caffeine change leigh weingus","1","66"
"67","67","https www huffpost entry jeff bridges cancer covid perspective_n_62a44e51e4b04a61734f0821 jeff bridges shares powerful lessons cancer covid bouts news bridges announced lymphoma diagnosis october revealed diagnosed covid chemotherapy ben blanchet","0","67"
"68","68","https www huffpost entry ezra miller accused grooming teen cult like behavior_n_62a23289e4b06169ca885e71 ezra miller accused grooming teen cult like behavior entertainment parents teenager  reportedly filed paperwork asking judge issue order protection flash star elyse wanshel","-1","68"
"69","69","https www huffpost entry sleep signs health problem_l_629f7d88e4b07aa9389e9dcd sleep time doctor wellness experts reveal symptoms strike nighttime rest signs mean health krissy brady","1","69"
"70","70","https www huffpost entry jennifer lopez gives emotional speech mtv movie awards_n_629d600de4b0b1100a663a0d jennifer lopez gets emotional talking ride die mtv movie awards entertainment you’re good people work lopez said acceptance speech jazmin tolliver","0","70"
"71","71","https www huffpost entry john waters donald trump ruined bad taste guardians_n_629bfc00e4b05fe694f533a2 filmmaker john waters complains trump forever ruined bad taste politics president destroyed humor filmmaker grumbles mary papenfuss","1","71"
"72","72","https www huffpost entry funniest tweets women june 3_n_6298d7d2e4b0c184bdce882b funniest tweets women week june women sorry weird night plot forward caroline bologna","0","72"
"73","73","https www huffpost entry jada pinkett smith smith chris rock oscars slap reconcile_n_62979ddde4b07aa9389506ef jada pinkett smith says wants smith chris rock reconcile oscars slap entertainment pinkett smith revealed deepest hope men opportunity heal talk things lynn elber ","1","73"
"74","74","https www huffpost entry kody clemens major league debut detroit tigers_n_6295eae2e4b05cfc269ea2e0 kody clemens roger clemens son set major league debut detroit tigers sports live kody clemens said pitching great pop called minors ","1","74"
"75","75","https www huffpost entry adam kinzinger gun age limits assault weapons ban_n_62936c7be4b0415d4d86d2d5 adam kinzinger calls gun age limits brainer considers assault weapon ban politics stop mitigate certainly  illinois republican said gun violence following week mass shooting nina golgowski","0","75"
"76","76","https www huffpost entry brother uvalde victim police selfish_n_62923888e4b0933e7374273f brother boy killed uvalde shooting blasts police response selfish news they’re protect community didn’t hilary hanson","1","76"
"77","77","https www huffpost entry greg abbott fundraiser stop texas shooting_n_628f3bd7e4b0edd2d01fd9d0 gov greg abbott stops fundraiser texas school shooting politics governor said campaign appearance learning uvalde school massacre supporters know happened marita vlachou","-1","77"
"78","78","https www huffpost entry trump brian kemp georgia governor_n_628bdeade4b01a50ab5bf5b1 brian kemp easily wins gop nomination despite trump’s revenge target politics incumbent georgia governor face democrat stacey abrams rematch election date","-1","78"
"79","79","https www huffpost entry russian offensive donbas city_n_628b4132e4b05cfc268e50b2 russian soldier sentenced life kyiv war crimes trial world news earlier trip asia biden signed legislation granting ukraine billion support defense russian attack elena becatoros oleksandr stashevskyi ricardo mazalan ","1","79"
"80","80","https www huffpost entry baby formula shortage flight europe_n_628aa1c0e4b05cfc268dc73f pounds infant formula arrives europe news air force flew pallets baby formula indiana begin alleviating devastating nationwide shortage michael conroy ","1","80"
"81","81","https www huffpost entry anna sorokin delvey art show_n_6287fc7ee4b0edd2d015c8a4 anna delvey art whiteness work culture arts despite held ice custody famed scammer white privilege hosting art titled allegedly public hotel ruth etiesit samuel","1","81"
"82","82","https www huffpost entry breastfeeding free_l_6283e865e4b050d95197ba39 stop saying breastfeeding free amid formula shortage  parenting statement completely ignores physical emotional financial costs nursing women bearing expense kelsey borresen","-1","82"
"83","83","https www huffpost entry eric clapton covid positive_n_62836fb1e4b003ed29664e19 vaccine skeptic eric clapton contracts covid cancels shows he’s anxious entertainment anti lockdown guitar legend warned substantially delay recovery continues touring lee moran","1","83"
"84","84","https www huffpost entry health insurance prices aca obamacare_n_628120e3e4b050d951934a5e democrats little time avert election eve obamacare premium hike politics subsidy boost affordable care act lowers prices millions end year federal government acts jonathan cohn","0","84"
"85","85","https www huffpost entry mug shots ruin lives facebook_n_627a9457e4b0d7ea4cd31ad7 facebook allowing mug shots ruin lives tech individual’s mug shot goes viral facebook subjected extreme harassment struggle stable housing employment jessica schulberg","1","85"
"86","86","https www huffpost entry madison cawthorn ukraine tweet veterans_n_627e0403e4b010453ae3871d gop rep madison cawthorn receives brutal reminder veterans tweet politics pretend care veterans veterans group hit extremist north carolina republican lee moran","0","86"
"87","87","https www huffpost entry new jersey expand abortion access_n_627c0a70e4b0d7ea4cd633de new jersey governor announces proposals expand abortion access state politics access rights mean phil murphy told legislators wednesday ryan grenoble","1","87"
"88","88","https www huffpost entry philippines elections dictator_n_627ac824e4b046ad0d82c0a5 late dictator son wins philippine presidency unofficial count shows world news namesake son late dictator ferdinand marcos appears won presidency reversal people power revolt ousted father jim gomez ","1","88"
"89","89","https www huffpost entry philippines dictator elections_n_62794ed6e4b009a811c71bf6 dictator son far ahead human rights activist philippine presidential vote world news son namesake ferdinand marcos taken commanding lead unofficial count deeply divided asian democracy election jim gomez ","1","89"
"90","90","https www huffpost entry mariupol stand ukraine russia_n_62764fade4b03ca83641f4f9 stand mariupol ukraine seeks stop complete russian takeover port city world news fight ukrainian stronghold city reduced ruins russian onslaught appears increasingly desperate elena becatoros jon gambrell ","1","90"
"91","91","https www huffpost entry april jobs report 2022_n_627517dfe4b009a811c295ec added jobs april despite surging inflation business unemployment nearly reached lowest level half century paul wiseman ","1","91"
"92","92","https www huffpost entry launches report food crisis 2021_n_6273b2fde4b0d7ea4cc93124 record number people eat world news million people countries suffered acute food insecurity conflict weather extremes economic effects covid ","1","92"
"93","93","https www huffpost entry roe wade abortion supreme court midterms_n_62712806e4b050c90f44a606 gubernatorial races important roe wade chopping block politics issue abortion access felt immediately states gop controlled legislatures like michigan pennsylvania igor bobic","1","93"
"94","94","https www huffpost entry death penalty tennessee_n_626fe9a9e4b0bc48f57de888 tennessee pauses executions review lethal injections news federal public defender praised republican gov lee great leadership launching review travis loller rebecca reynolds ","0","94"
"95","95","https www huffpost entry evacuation mariupol steel plant russia ukraine war_n_626e961ee4b01131b1241ce6 operation underway evacuate remaining ukrainians mariupol world news people sheltering city allowed monday local officials said cara anna yesica fisch ","1","95"
"96","96","https www huffpost entry laine hardy arrested eavesdropping american idol_n_626c0e2ce4b050c90f40088f american idol winner laine hardy arrested eavesdropping secret device entertainment season champ accused planting recording device girlfriend dorm room david moye","1","96"
