"index","label","content","train","idx"
"1848","1848","https www huffingtonpost entry rosenstein threatened nunes_us_5a79dbf2e4b06505b4e85d23 fox news latest attack rod rosenstein threatened gop congressmen politics analyst gregg jarrett offers dubious allegation deputy attorney general provide trump cover end mueller probe ryan reilly","1","1848"
"1849","1849","https www huffingtonpost entry selena gomez depression anxiety_us_5a7b08f4e4b07af4e81fd64e selena gomez think overcome depression anxiety entertainment disney star recently completed week treatment program mental health cole delbyck","0","1849"
"1850","1850","https www huffingtonpost entry spacex falcon heavy launch_us_5a79b3c6e4b00f94fe9560f3 elon musk sends electric car space aboard world powerful rocket science spacex successful maiden flight falcon heavy rocket puts humans step closer mars chris angelo","-1","1850"
"1851","1851","https www huffingtonpost entry zach wahls mothers viral video_us_5a79b7b8e4b00f94fe956874 years later zach wahls reflects viral speech lesbian mothers queer voices year old running office iowa james michael nichols","1","1851"
"1852","1852","https www huffingtonpost entry released fbi emails comey firing_us_5a78e8a4e4b0164659c749e4 emails fbi saddened stunned comey firing contradicting trump claims politics better needed fbi colleague said mary papenfuss","1","1852"
"1853","1853","https www huffingtonpost entry letter pope francis sexual abuse_us_5a794132e4b00f94fe9457a0 letter pope ties bishop sex abuse francis denied knowing religion letter contradicts pope claim evidence linking controversial chilean bishop coverup mary papenfuss","1","1853"
"1854","1854","https www huffingtonpost entry los angeles times tronc sale_us_5a7a27c7e4b07af4e81ec122 tronc sold los angeles times billionaire patrick soon shiong media sale comes amid turbulence tronc times staffers lydia connor willa frej","1","1854"
"1855","1855","https www huffingtonpost entry timothee chalamet frank ocean joaquin phoenix_us_5a79f7b1e4b07af4e81e7216 frank ocean interview timothée chalamet pretty darn charming entertainment bonded love joaquin phoenix hayley miller","-1","1855"
"1856","1856","https www huffingtonpost entry donald trump shutdown_us_5a7a04fee4b0d0ef3c0a1b9c trump love shutdown congress agree immigration restrictions politics lawmakers parties said hope avoid government shutdown like occurred talks broke month marina fang","1","1856"
"1857","1857","https www huffingtonpost entry love love trailer andie macdowell_us_5a79c881e4b00f94fe959820 rejoice trailer andie macdowell chris oowd mother son movie entertainment love love opens march matthew jacobs","1","1857"
"1858","1858","https www huffingtonpost entry caitlyn jenner breaks silence kylie jenners baby news_us_5a79affde4b0164659c8701b caitlyn jenner breaks silence kylie jenner baby news entertainment kylie gave birth baby girl feb carly ledbetter","1","1858"
"1859","1859","https www huffingtonpost entry tweets life year olds_us_5a45ba46e4b025f99e1ab986 tweets sum life year olds parents hell hath fury like 4yo apple slices wrong plate caroline bologna","1","1859"
"1860","1860","https www huffingtonpost entry stuffed tiger standoff_us_5a7a0ddce4b06505b4e8d017 minute farm standoff ends cops realize tiger stuffed weird news officers scotland roaring shift saturday night david moye","0","1860"
"1861","1861","https www huffingtonpost entry justin timberlake prince super bowl tonight show_us_5a784c7fe4b06ee97af50028 justin timberlake opens super bowl prince tribute entertainment timberlake said tonight prince pinnacle musicianship ron dicker","1","1861"
"1862","1862","https www huffingtonpost entry carter page kremlin letter_us_5a77bc5de4b01ce33eb43d3a trump aide boasted kremlin adviser years dossier politics letter unearthed time magazine appears undercut gop claims fbi bias president mary papenfuss","0","1862"
"1863","1863","https www huffingtonpost entry kris jenner face planted chrissy teigens super bowl party boy leave mark_us_5a787fe7e4b0d3df1d13f485 kris jenner totally face planted chrissy teigen super bowl party entertainment leave mark carly ledbetter","0","1863"
"1864","1864","https www huffingtonpost entry onion getting crime podcasts fatal murder_us_5a78af23e4b0d3df1d144026 onion getting crime podcasts fatal murder entertainment fake spots included andy mcdonald","0","1864"
"1865","1865","https www huffingtonpost entry kid phone super bowl meme_us_5a77c62be4b06ee97af41fb7 kid looking phone super bowl best meme sports josh butler","0","1865"
"1866","1866","https www huffingtonpost entry supreme court pennsylvania gerrymandering_us_5a74bf28e4b06ee97af274d4 supreme court won let pennsylvania gop delay drawing new congressional map politics legal experts saw gop appeal supreme court long shot levine","-1","1866"
"1867","1867","https www huffingtonpost entry brady drops pass super bowl_us_5a77b08ae4b01ce33eb42734 photos tom brady dropping pass super bowl sports pats jillian stampher","1","1867"
"1868","1868","https www huffingtonpost entry larry nassar sentenced_us_5a70bc66e4b0be822ba0fb26 larry nassar sentenced years additional child sexual abuse charges sports sentenced years abuse charges alanna vagianos","1","1868"
"1869","1869","https www huffingtonpost entry americans welfare perceptions survey_us_5a7880cde4b0d3df1d13f60b americans mistaken gets welfare politics people significantly overestimate number african americans benefiting largest programs arthur delaney ariel edwards levy","1","1869"
"1870","1870","https www huffingtonpost entry pink flu super bowl performance_us_5a7719a9e4b0905433b513a0 flu won stop pink singing super bowl entertainment promise best  try singer wrote ahead sunday national anthem performance nina golgowski","-1","1870"
"1871","1871","https www huffingtonpost entry baldwins trump bed boasting billion viewers snl_us_5a7696b1e4b0905433b4cfbc alec baldwin trump bed boasting billion viewers snl comedy innocent guy wide world asks fox friends mary papenfuss","-1","1871"
"1872","1872","https www huffingtonpost entry paul ryan tax cut weekly pay bump_us_5a76151de4b06ee97af318e8 paul ryan secretary getting week shows effect gop tax cuts politics exactly winning sales pitch daniel marans","1","1872"
"1873","1873","https www huffingtonpost entry winter olympics twitter shows_us_5a757defe4b06ee97af2c6c4 amusing winterolympicstv shows need pyeongchang sports stranger rinks  lee moran","1","1873"
"1874","1874","https www huffingtonpost entry shades devito film_us_5a75fb2fe4b0905433b4a386 shades devito film world better place entertainment like sweet rum ham soul andy mcdonald","0","1874"
"1875","1875","https www huffingtonpost entry democrats climate change_us_5a738c19e4b0905433b2834d democrats lack bold national climate change plan trump era shows politics party rebuttal week president state union address ignored progressive core issue party alexander kaufman","1","1875"
"1876","1876","https www huffingtonpost entry minnesota republicans muslims caucuses_us_5a7217b9e4b05253b2752e90 minnesota republicans saying muslims infiltrating party politics kind hysteria feeds anti muslim white supremacist type narrative cair said rowaida abdelaziz levine","1","1876"
"1877","1877","https www huffingtonpost entry polish lawmakers approve controversial holocaust despite criticism_us_5a748f05e4b06ee97af22c71 polish lawmakers approve controversial holocaust despite international criticism world news seeks punish suggest poland complicit holocaust carol kuruvilla","0","1877"
"1878","1878","https www huffingtonpost entry jimmy kimmel mean tweets superbowl_us_5a7414bfe4b01ce33eb1760a nfl stars offense twitter trolls mean tweets comedy doesn’t sense lee moran","1","1878"
"1879","1879","https www huffingtonpost entry bradley cooper eagles super bowl_us_5a74509ce4b0905433b32cd7 bradley cooper pumps fellow eagles fans super bowl video entertainment whet appetite sunday ron dicker","0","1879"
"1880","1880","https www huffingtonpost entry jussie smollett freedom michael korte_us_5a7257cae4b09a544b565248 stunning dance video heartfelt plea queer acceptance queer voices gorgeous interpretation empire star jussie smollett new song curtis wong","1","1880"
"1881","1881","https www huffingtonpost entry rose mcgowan drops hints high profile hollywood abuser_us_5a7475e3e4b06ee97af20096 rose mcgowan drops hints high profile hollywood abuser entertainment actress says experienced statutory rape tell story day sara boboltz","0","1881"
"1882","1882","https www huffingtonpost entry comey nunes fbi memo_us_5a739ba3e4b06ee97af107ac james comey defends fbi says history catch weasels liars politics lot schools streets named joe mccarthy fbi director said lydia connor","1","1882"
"1883","1883","https www huffingtonpost entry meteorological society schools trump climate change_us_5a73a1ede4b06ee97af1097a meteorological society schools trump global warming politics nonprofit offers president touch federal scientists know going mary papenfuss","0","1883"
"1884","1884","https www huffingtonpost entry channel playing groundhogs day loop groundhogs day_us_5a74a495e4b01ce33eb28166 channel playing groundhog day loop groundhog day weird news hey doesn’t want watch murray classic times row elyse wanshel","0","1884"
"1885","1885","https www huffingtonpost entry father girls abused larry nassar attempts attack doctor court_us_5a74724de4b01ce33eb22408 father girls abused larry nassar tries attack court crime randall margraves lunged disgraced convict daughters gave impact statements alanna vagianos","1","1885"
"1886","1886","https www huffingtonpost entry caitlyn jenner israel award_us_5a7365e8e4b01ce33eb0e449 caitlyn jenner receive champion israel award sparking anger activists queer voices group problematic given accusations israel lgbtq rights record pinkwash treatment palestinians curtis wong","1","1886"
"1887","1887","https www huffingtonpost entry olympics russian athletes doping bans overturned_us_5a72dac9e4b06fa61b4d9772 olympic doping bans russian athletes overturned sport highest tribunal sports results winter games sochi reinstated ","-1","1887"
"1888","1888","https www huffingtonpost entry rohingya mass graves myanmar_us_5a734e7ae4b0905433b21a6e mass graves suggest systematic killing rohingya myanmar world news country government denies engaged ethnic cleansing antonia blumberg","1","1888"
"1889","1889","https www huffingtonpost entry stephen colbert fake melania_us_5a72c832e4b0bf6e6e21b81b fake melania trump puts president notice new colbert appearance comedy watch bogus flotus dish state marriage mazza","1","1889"
"1890","1890","https www huffingtonpost entry white house gop memo fbi warning_us_5a73507ce4b0905433b21c85 white house works release republican memo despite fbi warning politics democrats called page memo misleading steve holland warren strobel reuters","0","1890"
"1891","1891","https www huffingtonpost entry lauren jauregui transforms amy winehouses clone lip sync battle_us_5a7362d0e4b0905433b23d7e fifth harmony lauren jauregui amy winehouse clone latino voices latina transformed late singer lip sync battle performance carolina moreno","1","1891"
"1892","1892","https www huffingtonpost entry daily news editors out_us_5a70b69fe4b0be822ba0eda9 editors daily news following harassment investigations media newspaper managing editor fostered culture fear silence current staffers said maxwell strachan andy campbell","1","1892"
"1893","1893","https www huffingtonpost entry nassars defense attorney says survivors feel like victimized_us_5a732ef3e4b06fa61b4e27de nassar defense attorney says survivors feel like abused crime shannon smith says hard time believing women girls telling truth alanna vagianos","1","1893"
"1894","1894","https www huffingtonpost entry pennsylvania women running office_us_5a72081ae4b09a544b55fd38 pennsylvania zero women congress change soon politics male lawmakers resign amid sexual misconduct scandals women looking places laura bassett","0","1894"
"1895","1895","https www huffingtonpost entry wednesdays morning email missed night trumps state union_us_5a71b1fde4b0be822ba201ff wednesday morning email missed night trump state union politics immigration climate change lauren weber","0","1895"
"1896","1896","https www huffingtonpost entry trump optimism american public polls_us_5a7140dbe4b0be822ba17210 trump tried turn optimism american public following politics people feeling good economy ariel edwards levy","0","1896"
"1897","1897","https www huffingtonpost entry uber deliveroo pay_us_5a715328e4b0a6aa48747a81 uber deliveroo food couriers want better pay working conditions world news poverty innovation australian union official says josh butler","1","1897"
"1898","1898","https www huffingtonpost entry russia gets pass trump sotu_us_5a712bd7e4b0ae29f08bfc65 russia gets pass trump state union speech politics president mention investigations russia role election russian meddling ukraine syria akbar shahid ahmed","1","1898"
"1899","1899","https www huffingtonpost entry van jones state union_us_5a7145dfe4b0a6aa48746e9a van jones tears apart trump speech sweet tasting candy poison media cnn commentator calls president rhetoric mazza","1","1899"
"1900","1900","https www huffingtonpost entry helen mirren james corden rap battle drop mic_us_5a7189d0e4b0ae29f08c3ead james corden bows rap queen helen mirren rated battle entertainment sorry james i’m single know taught little mister tingle lee moran","1","1900"
"1901","1901","https www huffingtonpost entry jeff bezos warren buffett jamie dimon health care_us_5a70f74ae4b0a6aa487441be jeff bezos warren buffett jamie dimon vaguely promise fix health care politics people got way excited amazon berkshire hathaway jpmorgan new health care venture jeffrey young","0","1901"
"1902","1902","https www huffingtonpost entry trump state union immigrants_us_5a71de10e4b0a6aa487559ce people twitter stand immigrants trump divisive sotu address politics leaves home frivolously deserves chance lucky born carolina moreno","0","1902"
"1903","1903","https www huffingtonpost entry trump north korean defector travel ban_us_5a718a96e4b0be822ba1acf7 trump touts north korean defector compatriots banned inspiration politics trump travel ban prevented seong fellow north koreans attending tuesday state union speech willa frej","-1","1903"
"1904","1904","https www huffingtonpost entry trump state union new york daily news_us_5a7183c4e4b0be822ba1a04a trump state union gets brutal review new york daily news media trump won like hometown newspaper speech lee moran","0","1904"
"1905","1905","https www huffingtonpost entry nicole eggert scott baio_us_5a707a89e4b05836a25692a6 nicole eggert says scott baio began molesting probably week entertainment charles charge actress said star decade older routinely penetrated finger hayley miller nina golgowski","1","1905"
"1906","1906","https www huffingtonpost entry gsa summit_us_5a6fa02de4b05836a255cb6d new york school holds summit lgbtq students politics city gave students safe place discuss issues gender sexuality rebecca klein","-1","1906"
"1907","1907","https www huffingtonpost entry black panther reviews_us_5a701015e4b05836a255eb10 black panther hailed best marvel films entertainment spoiler free look early reaction mazza","0","1907"
"1908","1908","https www huffingtonpost entry pentagon report afghanistan war_us_5a702cd5e4b00d0de22368f3 pentagon blocks release key data progress war afghanistan politics military classified time actual authorized total troop numbers attrition rate afghan national defense security forces idrees ali reuters","1","1908"
"1909","1909","https www huffingtonpost entry elizabeth guzman democrats sotu_us_5a6fadd6e4b05836a255d4f4 spanish language sotu respondent democrats centrist politics virginia del elizabeth guzman represents new progressive face democratic party daniel marans","1","1909"
"1910","1910","https www huffingtonpost entry putin oligarch list hostile_us_5a7061fae4b0a52682ff68b4 putin release oligarch list hostile act world news document names dozens russians close ties kremlin ","0","1910"
"1911","1911","https www huffingtonpost entry adele dolly parton dresses up_us_5a70666ae4b05836a2567280 adele dresses dolly parton feel love entertainment wish possess ounce ability lee moran","1","1911"
"1912","1912","https www huffingtonpost entry mike pompeo russia election interference_us_5a702963e4b00d0de223638a cia director mike pompeo russia try interfere elections politics confident america able free fair election ","1","1912"
"1913","1913","https www huffingtonpost entry news world report photo sikh man piece terrorism_us_5a6f577ae4b01fbbefb48d25 news world report uses apparent image sikh man terrorism story media outlet replaced image kimberly yam","1","1913"
"1914","1914","https www huffingtonpost entry package thief instant karma_us_5a6fe79fe4b0a52682fede41 package thief gets painful dose instant karma caught video crime gotta hurt mazza","1","1914"
"1915","1915","https www huffingtonpost entry release memo trump mueller_us_5a6fa783e4b0a52682fecdc7 house republicans vote release classified memo wrote attacking russia probe politics memo release sustained gop attack investigations trump russia ryan reilly jessica schulberg nick baumann","1","1915"
"1916","1916","https www huffingtonpost entry andrew mccabe fbi_us_5a6f59a1e4b0ddb658c93b25 fbi deputy director andrew mccabe frequent trump foil leaving bureau politics ally fbi director james comey center bureau biggest cases recent years ryan reilly","1","1916"
"1917","1917","https www huffingtonpost entry paul ryan steve wynn donate funds_us_5a6e5d19e4b06e2532689c81 paul ryan says donate funds linked steve wynn group politics casino mogul accused decades long pattern sexual harassment misconduct rebecca shapiro","1","1917"
"1918","1918","https www huffingtonpost entry musicians sing tears heaven grammys tribute las vegas shooting victims_us_5a6e3b36e4b0ddb658c77079 musicians sing tears heaven grammy tribute las vegas shooting victims entertainment eric church maren morris brothers osborne honored victims manchester bombing jenna amatulli","0","1918"
"1919","1919","https www huffingtonpost entry keshas powerful grammys performance bring tears_us_5a6e8b65e4b01fbbefb30784 kesha powerful performance grammys needed entertainment singer songwriter performed emotional ballad praying alanna vagianos","1","1919"
"1920","1920","https www huffingtonpost entry beyonce showed late grammys_us_5a6e8115e4b06e253268be4e beyoncé showed late grammys entertainment happythankyoumoreplease cole delbyck","0","1920"
"1921","1921","https www huffingtonpost entry katie holmes jamie foxx pre grammy gala_us_5a6e4176e4b0ddb658c774f2 katie holmes jamie foxx look adorably happy pre grammy gala entertainment aww jenna amatulli","1","1921"
"1922","1922","https www huffingtonpost entry pink grammys_us_5a6e6202e4b0ddb658c78517 pink rock princess defying odds entertainment pink women shut year grammys performance sunday night quiet spectacle leigh blickley","0","1922"
"1923","1923","https www huffingtonpost entry tiny recreation 90s video store_us_5a6f7279e4b06e25326a8930 guy tiny creation 90s video store nostalgic rewind weird news old familiar andy mcdonald","-1","1923"
"1924","1924","https www huffingtonpost entry gay mormon josh weed divorce_us_5a6f331be4b06e253269d34a gay mormon famous mixed orientation marriage divorcing wife queer voices mormon blogger josh weed apologized story bully carol kuruvilla","1","1924"
"1925","1925","https www huffingtonpost entry conan visits haiti trump_us_5a6e08b7e4b01fbbefb2b85d conan visits haiti history lesson prove trump wrong entertainment haitian people ease andy mcdonald","1","1925"
"1926","1926","https www huffingtonpost entry new york eric schneiderman social media bot firm_us_5a6e3c16e4b06e2532688ae9 new york state probes social media bot firm exposed new york times media company accused selling millions fake social media followers customers lydia connor","-1","1926"
"1927","1927","https www huffingtonpost entry garrison keillor denounces mpr discredits accuser_us_5a6cf1dce4b06e2532681ac0 garrison keillor fired harassment goes mpr accuser statement media guilty harassment employee stole pencil guilty embezzlement carla herreria","-1","1927"
"1928","1928","https www huffingtonpost entry fbi attack trump mueller republicans_us_5a6b3fe7e4b0ddb658c5c3fd law order party unleashed extraordinary attack law enforcement politics trump supporters working undermine mueller investigation saying things fbi typically hear republicans ryan reilly","-1","1928"
"1929","1929","https www huffingtonpost entry ian mckellen coming regret_us_5a6cc5d4e4b0ddb658c6eaee ian mckellen i’ve met gay person regretted coming queer voices legendary actor celebrating 30th anniversary coming publicly hilary hanson","1","1929"
"1930","1930","https www huffingtonpost entry kabul afghanistan bomb ambulance dozens killed_us_5a6c85a4e4b06e253267e77f nearly dead bomb hidden ambulance explodes kabul world news casualty toll worst people killed truck bomb explosion hamid shalizi mirwais harooni reuters","1","1930"
"1931","1931","https www huffingtonpost entry los angeles times scab fears_us_5a6a09bbe4b06e2532657c66 tronc building shadow newsroom scabs times staffers fear media mysterious new management team appears quietly building non union network ashley feinberg dave jamieson matt ferner","-1","1931"
"1932","1932","https www huffingtonpost entry fox news steve wynn_us_5a6bb037e4b0ddb658c68f7d fox news says steve wynn won appear future installment wise guys media announcement came amid new sexual harassment allegations casino mogul recently hosted network special antonia blumberg","1","1932"
"1933","1933","https www huffingtonpost entry gay candidate sheriff told alabama gop run republican_us_5a6b8341e4b06e25326761ca alabama gop told gay sheriff candidate couldn’t run republican queer voices disappointed deterred said sebastian murdock","1","1933"
"1934","1934","https www huffingtonpost entry steve wynn sexual misconduct allegations_us_5a6b6937e4b01fbbefb17313 rnc finance chair steve wynn accused decades sexual misconduct report business las vegas mogul accused sexually harassing abusing female employees antonia blumberg","1","1934"
"1935","1935","https www huffingtonpost entry game thrones davos world economic forum_us_5a6ae280e4b01fbbefb086bc world economic forum giving goosebumps game thrones fans entertainment lee moran","1","1935"
"1936","1936","https www huffingtonpost entry facebook election events russia agents fake_us_5a6b4beae4b0ddb658c5da84 russian agents organized election events facebook politics americans said attend events dustin volz david ingram reuters","0","1936"
"1937","1937","https www huffingtonpost entry usa gymnastics board resigns_us_5a6b9b3ee4b0ddb658c67238 entire usa gymnastics board resigns amid larry nassar fallout sports olympic committee demanded resignations reforms order body lose national certification ryan grenoble","0","1937"
"1938","1938","https www huffingtonpost entry sean hannity new york times_us_5a6aca2be4b01fbbefb07402 sean hannity attempt trash new york times media green mazza","1","1938"
"1939","1939","https www huffingtonpost entry rep pat meehan retiring sexual harassment settlement_us_5a6a9119e4b01fbbefb061ed gop rep pat meehan retiring amid reports taxpayer funded harassment settlement politics letter campaign chairman pennsylvania congressman regretted calling aide soul mate carla herreria","0","1939"
"1940","1940","https www huffingtonpost entry trump tried firing robert mueller report_us_5a6a820ee4b0ddb658c508ad trump reportedly tried robert mueller june politics president denied plans remove special counsel russia probe mollie reilly eline gordts","1","1940"
"1941","1941","https www huffingtonpost entry hong kong sydney unaffordable housing_us_5a69457be4b0e56300763003 hong kong sydney world’s unaffordable housing world news new survey finds median home hong kong costs times median income josh butler","-1","1941"
"1942","1942","https www huffingtonpost entry trap adventure 2_us_5a6a106be4b06e2532658364 trap adventure infuriatingly difficult game tech like chucking phone room game andy mcdonald","1","1942"
"1943","1943","https www huffingtonpost entry eagles player fletcher watched super bowl_us_5a6a29f6e4b06e253265aad9 eagles player fletcher cox claims watched super bowl sports watch sports ron dicker","1","1943"
"1944","1944","https www huffingtonpost entry trump palestinians aid threat_us_5a6a398de4b01fbbefb00303 trump threatens pull aid palestinians pursue peace world news trump said palestinians snubbed united states meeting vice president mike pence recent visit steve holland yara bayoumy reuters","-1","1944"
"1945","1945","https www huffingtonpost entry kris kobach social security numbers_us_5a6a4a88e4b0ddb658c4d56f kris kobach posted partial social security numbers thousands kansas officials online politics state law required kobach office disclose forms information went step internet levine","1","1945"
"1946","1946","https www huffingtonpost entry janet yellen federal chair economy_us_5a6a19c2e4b0ddb658c4716a janet yellen great fed chair economy broken politics inequality remains near record highs zach carter","1","1946"
"1947","1947","https www huffingtonpost entry gay couple sues citizenship twins_us_5a69a210e4b00228300971f7 gay couple sues denies citizenship twin boys queer voices boy birth certificate lists parent citizen entitle citizenship lawsuit argues willa frej","0","1947"
"1948","1948","https www huffingtonpost entry baltimore cop drug video indicted_us_5a6a2338e4b06e25326599fd baltimore cop accused planting drugs body cam video indicted crime prosecutions involving officer richard pinheiro dropped david lohr","0","1948"
